TYPE,ISTITLE,TOPIC
9,0,GM crops might change whole ecosystems. 
9,0,Food chains could be broken if crops are resistant to predators. 
9,0,Organic foods are produced without chemicals or genetic modification. 
9,0,"Organic farming may be slower and more expensive. However, the environment is not damaged by fertilisers or pesticides."
10,1,Problems in Developing Countries
10,0,Developing countries face a range of problems. 
10,0,Standards of healthcare and education are low. 
10,0,Life expectancy is usually lower than in developed countries. 
10,0,"There is a lack of infrastructure, employment and good quality housing. "
10,0,Many people are forced to live in poverty. 
10,0,"Food, drinking water and basic medicines are in short supply."
10,1,How to Help Developing Countries
10,0,The best form of help for developing countries is development aid. 
10,0,Richer nations can help by investing in long-term projects. 
10,0,Governments and charities can help by building new houses and schools. 
10,0,Globalisation may also help developing countries. 
10,0,Multi-national companies are creating jobs in developing countries. 
10,0,"On the other hand, many people emigrate to find work in richer countries. "
10,0,They often send money back home to their families. 
10,0,This money helps to improve the standard of living in developing countries.
10,1,Immigration
10,0,Some people move to another country in search of a better life. 
10,0,Many immigrants come from less developed countries. 
10,0,"Richer, industrialised countries may offer opportunities for employment. "
10,0,Free healthcare and schooling are available in some developed countries. 
10,0,Other people migrate to a foreign country to improve their academic qualifications.
10,1,Positives of Immigration and Multi-Cultural Societies
10,0,"From an economic perspective, immigration can be extremely positive. "
10,0,Many immigrants have skills that are needed in the country they move to. 
10,0,Immigrants who find work contribute to the economy of their new country. 
10,0,Many immigrants send money home to help family members. 
10,0,Immigration also creates cultural diversity. 
10,0,People of many different nationalities learn to live together. 
10,0,This can help people to become more open-minded and tolerant.
10,1,Negatives of Immigration
10,0,Some people believe that immigrants take jobs that should go to local people. 
10,0,Some immigrant workers work longer hours for less money. 
10,0,Companies might pay lower salaries to immigrant workers. 
10,0,Unemployment rates could rise if there are too many immigrants.
10,1,Opinions about Immigration
10,0,Immigration can help the economy of a country.
10,0,"It can create multi-cultural societies. However, immigration needs to be controlled. "
10,0,"In many countries, immigrants need visas or work permits. "
10,0,Governments should stop companies from exploiting immigrant workers. 
10,0,Foreign and local workers should have the right to equal pay and conditions.
10,1,Positives of Globalisation
10,0,Business is becoming increasingly international. 
10,0,Multi-national companies do business across the world. 
10,0,Companies like MacDonald’s can be seen on high streets in most cities. 
10,0,Goods are produced in one country and sold in many others.
10,0,A global economy means free trade between countries. 
10,0,This can strengthen political relationships. 
10,0,Globalisation can also create opportunities for employment. 
10,0,It encourages investment in less developed countries. 
10,0,It could reduce poverty in the developing world.
10,1,Negatives of Globalisation
10,0,Globalisation is not always beneficial to everyone. 
10,0,Companies can move to countries where labour is cheap. 
10,0,"This creates redundancies, or job losses. "
10,0,Employees cannot be confident that they have stable jobs. 
10,0,Companies sometimes exploit their employees in developing countries. 
10,0,Global trade creates more waste and pollution.
10,1,The Future of Globalisation
10,0,There should be global regulations for salaries and working conditions. 
10,0,Governments should impose laws to protect the environment.
11,1,What governments can do
11,0,Governments provide public services like healthcare and education. 
11,0,They support people who are living in poverty or unable to work.
11,0,Governments raise money by taxing working people. 
11,0,They can spend money on resources and campaigns. 
11,0,They can introduce new laws. 
11,0,They can impose taxes. 
11,0,They can raise people’s awareness of issues (e.g. climate change/healthy eating).
11,0,They can influence people’s habits and opinions. 
11,0,They can create jobs. 
11,0,They can regulate the activities of companies such as banks. 
11,0,They can provide resources for schools. 
11,0,They are also responsible for the security and well-being of their citizens. 
11,0,They control armed forces and police forces.
11,1,Public Services
11,0,Governments pay the salaries of public sector workers like police officers and teachers. 
11,0,The necessary money is raised by taxing people’s income. 
11,0,Free education and healthcare may be provided by the state. 
11,0,Some governments control public transport systems and even TV channels. 
11,0,"In other countries, these services are provided by private companies. "
11,0,Some people believe that competition between private companies is good. 
11,0,It helps to improve quality while bringing prices down. 
11,0,Other people think that essential services should be free. Governments should pay for them.
11,1,Censorship: Opinion
11,0,Governments can censor what the public sees or reads in the media.
11,0,To a certain extent censorship is necessary. 
11,0,We should use censorship to protect children from violent images. 
11,0,Some computer games involve killing people or committing crimes. 
11,0,The Internet also needs to be controlled. 
11,0,Many websites show pornography and violence. 
11,0,There should be age limits for websites and computer games. 
11,0,Parents need to take responsibility for checking what their children watch. 
11,0,It is impossible for governments to control everything we see.
11,1,Video Cameras in Public Places
11,0,The use of CCTV is becoming widespread. Video cameras have been installed in many public places. 
11,0,They are supposed to protect us and deter criminals. 
11,0,Many people think that this surveillance violates our privacy. 
11,0,The authorities could build databases with our pictures and identities. 
11,0,We should not be treated like criminals.
11,1,Smart Cards: Positives
11,0,Governments will probably introduce a digital identification card system. 
11,0,Smart cards will have benefits and drawbacks. 
11,0,They could help to reduce crime. 
11,0,"They could hold personal information, such as DNA. "
11,0,Digital bank cards could contain fingerprint information. 
11,0,It would be very difficult for criminals to use a stolen card. 
11,0,It would be easier for police to identify people and catch criminals.
11,1,Smart Cards: Negatives
11,0,Many people are worried about losing their privacy. 
11,0,Governments could store all our personal and medical information. 
11,0,This information could be used by insurance companies. 
11,0,Employers could check our health records.
11,1,People with Disabilities
11,0,People with disabilities should be treated the same as everybody else. 
11,0,They should have the same rights as other people. 
11,0,They should have access to the same jobs as other citizens. 
11,0,Discrimination against disabled people is illegal in many countries. 
11,0,Ramps and lifts for wheelchairs should be installed in public buildings. 
11,0,Support teachers can be employed to help children with learning difficulties.
12,1,Why guns should be legal:
12,0,"In some countries, people are allowed to own firearms. "
12,0,Individuals have the right to protect themselves. 
12,0,People can use guns in self-defence. This deters criminals.
12,1,Why gun ownership should be illegal:
12,0,There is a risk of accidents with guns. 
12,0,The number of violent crimes increases when guns are available. 
12,0,Criminals may be armed. The police then need to use guns. 
12,0,Suicide rates have been shown to rise when guns are available. 
12,0,Guns create violent societies with high murder rates.
12,1,Why police should use guns:
12,0,Many criminals use weapons. 
12,0,The threat of a gun can deter criminals. 
12,0,Police officers can force a criminal to surrender. 
12,0,It is easier to arrest someone and avoid physical violence. 
12,0,The police may shoot violent criminals in self-defence. 
12,0,They can protect the public. 
12,0,They can shoot an escaping criminal who poses a serious danger to the public.
12,1,Why police should not carry guns:
12,0,There is a risk of accidents and mistakes. 
12,0,The police might shoot an unarmed criminal or an innocent person. 
12,0,Accidents can happen in public places. 
12,0,"There are several alternatives to guns (e.g. tear gas, sprays and electric shock weapons)."
12,0,Only special police units should use guns.
12,1,Arms Trade: Positives
12,0,"The export of arms, or weapons, is an extremely controversial issue. "
12,0,"Governments of rich, industrialised countries sell arms to each other. "
12,0,This industry creates jobs and wealth. 
12,0,The trade of weapons may improve relationships between governments.
12,1,Arms Trade: Negatives
12,0,Weapons may be used in conflicts and wars. 
12,0,The supply of arms could be responsible for deaths.
12,0,Governments are promoting war in order to make a profit. 
12,0,Rich countries can influence the politics of other nations.
12,1,Nuclear Weapons
12,0,Nuclear weapons are capable of destroying whole cities. 
12,0,A nuclear war between two countries would destroy both countries. 
12,0,Nuclear weapons are used as a deterrent. They prevent wars from starting.
12,1,Nuclear Weapons: Opinion
12,0,Nuclear weapons should be prohibited. 
12,0,Governments should limit the production of nuclear weapons.
12,0,There is a danger of nuclear weapons being obtained by terrorists. 
12,0,Nuclear weapons cannot be used against terrorist organisations.
12,1,Armed Forces: Positives
12,0, Armed forces provide security and protection. 
12,0,They deter military attack by another country. 
12,0,They can also be used to maintain peace within countries. 
12,0,They can be used to give the police extra support. 
12,0,"Soldiers are also used to help in emergency situations, such as after a natural disaster."
12,1,Armed Forces: Negatives
12,0,Armies require a lot of funding from governments. 
12,0,Too much money is spent on weapons and military technology. 
12,0,"This money could be spent on schools, hospitals and other public services."
13,1,Diet
13,0,The human body requires a balanced diet. 
13,0,An unhealthy diet can cause various health problems. 
13,0,"Obesity, diabetes and heart disease are on the increase. "
13,0,Many people nowadays rely on fast food or pre-prepared meals. 
13,0,"These foods often contain too much fat, salt and sugar. "
13,0,They are cheap to buy and very easy to prepare. 
13,0,Many young people have grown up on a diet of convenience foods. 
13,0,Populations in developed countries are increasingly overweight.
13,1,Exercise
13,0,Regular exercise is essential in maintaining a healthy body. 
13,0,Exercise burns calories and helps to build healthy bones and muscles.
13,0,Doctors advise exercising at least three times a week for 20 minutes. 
13,0,Most people nowadays lead a sedentary lifestyle. 
13,0,We tend to walk less and do desk jobs. 
13,0,Most adults relax by watching television. 
13,0,Children play video games rather than doing outdoor sports. 
13,0,"In the past, people were more active in their jobs and at home."
13,1,Governments’ Role
13,0,Governments have a significant role to play in reducing obesity. 
13,0,"More and more people, including young children, are seriously overweight. "
13,0,They are at risk of heart disease and diabetes. 
13,0,This situation will increase the burden on hospitals and taxpayers. 
13,0,Hospitals rely on the government for money and resources. 
13,0,Governments should promote a healthy diet and regular exercise.
13,0,There should be more time for sport on school timetables. 
13,0,Unhealthy junk food should be banned from school menus. 
13,0,People need information about what foods contain. 
13,0,Food packaging must show the food’s nutritional content. 
13,0,The British Government recommends eating five portions of fruit and vegetables per day.
13,1,State Health Systems: Advantages
13,0,Good healthcare should be available to everyone for free. 
13,0,State healthcare is paid by the government using money from taxes. 
13,0,Everyone has access to the same quality of care and treatment. 
13,0,Private healthcare is unfair because only wealthy people can afford it. 
13,0,The National Health Service in the UK provides free healthcare for every resident.
13,1,Private Healthcare: Advantages
13,0,State hospitals are often very large and difficult to run. 
13,0,Private hospitals have shorter waiting lists for operations and appointments. 
13,0,Patients can benefit from faster treatment.
13,0,Many people prefer to pay for a more personal service. 
13,0,Patients have their own room and more comfortable facilities.
13,1,Alternative Medicine: Positives
13,0,"People are increasingly using alternative medicines to treat illnesses. For example, acupuncture can be used to treat backache. "
13,0,Herbal medicines can be used to treat allergies or viruses. 
13,0,Many patients report positive experiences with these treatments. 
13,0,Some traditional cures have been used for hundreds of years.
13,1,Alternative Medicine: Negatives
13,0,Many alternative medicines have not been tested scientifically. 
13,0,They may have no beneficial effects at all. 
13,0,They may cause unknown side effects. 
13,0,People should trust the opinions of qualified doctors. 
13,0,An illness could get worse without treatment from a doctor.
13,1,Stress
13,0,Modern lifestyles are increasingly stressful. 
13,0,People work long hours with strict deadlines. 
13,0,Our busy lifestyles mean we have less time to relax. 
13,0,Unemployment is a major cause of stress. 
13,0,Children may be affected by their parents’ relationship problems. 
13,0,Tests and exams can also cause stress.
13,1,How to Reduce Stress
13,0,Stress can be reduced by taking regular exercise and eating a healthy diet. 
13,0,It is also important to get sufficient sleep and make leisure time a priority. 
13,0,People should work less overtime and take regular holidays. 
13,0,Schools have started to employ psychologists. They can offer emotional support to students.
14,1,State / Council Housing
14,0,In some countries the government provides state or council housing. 
14,0,This helps people who cannot afford to buy their own house. 
14,0,It can be argued that state housing creates dependence on the government. 
14,0,People should not rely on the government to look after them. 
14,0,People have no incentive to earn money and buy their own home. 
14,0,"Council properties are often made with cheap, poor-quality materials."
14,1,Old Buildings
14,0,Historic buildings are part of a country’s heritage. 
14,0,They should be protected. 
14,0,Old buildings are often considered to be works of art. 
14,0,They give character to cities and attract tourists. 
14,0,They show us how people lived in the past. 
14,0,We identify countries by architectural symbols like the pyramids in Egypt. 
14,0,Governments should spend money on looking after historic buildings. 
14,0,They need regular repairs and maintenance. 
14,0,New buildings should be designed to complement them.
14,1,Modern / Green Buildings
14,0,Modern buildings should be designed to be environmentally friendly. 
14,0,They should use less energy and produce less waste. 
14,0,Modern insulation can make houses more energy-efficient. 
14,0,Solar and wind power can be used to generate electricity. 
14,0,Rainwater and waste water can be recycled and used to flush toilets.
14,0,Modern glass buildings take advantage of natural light.
15,1,English as an International Language
15,0,English is widely used around the world. It is becoming a global second language. 
15,0,"It is the dominant language of technology, science and international business. "
15,0,International business meetings are regularly held in English. 
15,0,The most important textbooks and journals are published in English. 
15,0,The ability to speak English is a necessary skill in the modern world.
15,1,Negatives of English as an International Language
15,0,"If one language is dominant, other languages may disappear. The dominant language brings its own culture. "
15,0,American culture has become popular around the world. 
15,0,Other cultures may be damaged. 
15,0,"As an alternative to English, a new global language could be invented. "
15,0,It would have no nationality or culture attached to it. 
15,0,This could help to promote international peace and understanding. 
15,0,Esperanto is an example of a language that was invented with this aim.
16,1,Money and Society
16,0,Society has become increasingly materialistic. 
16,0,People aspire to earn more money. They want a bigger house or a better car. 
16,0,We connect wealth and material possessions with happiness and success. 
16,0,Brands like ‘Armani’ or ‘Mercedes’ are status symbols. 
16,0,Advertising creates new desires and needs. It persuades us to buy the latest styles.
16,1,Positives of Consumerism
16,0,Consumerism creates employment. 
16,0,It helps to reduce poverty. 
16,0,It encourages innovation and creativity in business.
16,0, We live in a global economy. 
16,0,We have a better quality of life.
16,1,Negatives of Consumerism
16,0,Consumerist societies create more waste. 
16,0,They use more natural resources. 
16,0,They cause damage to the environment. 
16,0,Consumerism creates a “throw-away” culture.
16,0, Advertisers tell us who we are and what we want. 
16,0,Wealth does not lead to happiness. 
16,0,Materialism causes greed and crime. 
16,0,We should return to traditional values like sharing.
17,1,Happiness
17,0,Happiness means different things to different people. 
17,0,It can be described as a feeling of pleasure or enjoyment. 
17,0,People enjoy spending time with family and friends. 
17,0,"Hobbies, sports and games can be a source of fun and enjoyment. "
17,0,Some people see money as a source of happiness. 
17,0,Other people define happiness as something deeper. 
17,0,In order to be truly happy it is necessary to live a good life. 
17,0,We need to feel that we are doing something useful with our lives. 
17,0,Some people get a sense of achievement from their work. 
17,0,Others find happiness in bringing up their children. 
17,0,Religion or a sense of purpose can also be a source of happiness.
17,1,Success
17,0,People define success in different ways. 
17,0,"Some people get a sense of achievement from raising a family. For others, success is defined by wealth or status. "
17,0,We often think of rich and famous people as being successful in life. 
17,0,Millionaires like Bill Gates are considered to be successful. They have risen to the top in their chosen professions. 
17,0,"For some, being successful means achieving personal or professional goals. "
17,0,They see success as the result of hard work. 
17,0,Success in any field requires long-term planning and effort.
17,1,Nature or Nurture
17,0,Some people believe that our personalities are determined mainly by genetics. 
17,0,We inherit our abilities and talents from our parents. 
17,0,Others think that our education and upbringing are more important.
17,0,We develop according to the influences around us. 
17,0,Our personalities and achievements depend more on nurture than nature. 
17,0,Many people argue that we control our own destinies. 
17,0,We can shape our own personalities. 
17,0,By working hard we can achieve any goal that we put our minds to. 
17,0,Many successful people are “self-made”. 
17,0,We are not limited by our genetic characteristics or upbringing.
18,1,Arguments against Professional / Competitive Sport
18,0,Sport has become a business. 
18,0,Professional sport encourages people to compete for money. 
18,0,Many sports stars are only concerned about money and fame. 
18,0,Some athletes take drugs in order to win at any cost. 
18,0,Competitors are often selfish and rude. 
18,0,They are not good role models for children. 
18,0,All sports should be amateur. 
18,0,Sports should be leisure activities rather than jobs. 
18,0,People should do sporting activities for enjoyment and health reasons. 
18,0,Taking part is more important than winning.
18,1,Arguments for Professional Sport
18,0,Professional sports are the same as any other business. 
18,0,Many people are employed in the sports industry. 
18,0,People should be able to use their talents to earn a salary. 
18,0,Sports stars entertain millions of people. 
18,0,Money is necessary to improve facilities and train athletes. 
18,0,The level of professional sport is much higher than that of amateur sport.
18,1,Arguments for Competitive Sport
18,0,Competition is a natural instinct in humans. 
18,0,In daily life we compete to get jobs or the highest grades. 
18,0,Sports are a safe form of competition. 
18,0,Competition is healthy because it pushes us to give our best. 
18,0,Competitors and fans can release energy and aggression. 
18,0,Supporters of teams feel a sense of belonging to a community.
18,1,Opinion: professional sport salaries are too high
18,0,Sports professionals earn too much money. 
18,0,They do not provide a vital service. 
18,0,"Football players, for example, earn enormous salaries by simply kicking a ball. "
18,0,We could all live happily without professional football. 
18,0,"Life would be difficult without doctors, engineers and other vital professionals. "
18,0,Society does not seem to value these professions as highly as professional sport. 
18,0,Sports salaries should be compatible with the wages most people earn.
18,1,Opinion: professional sport salaries are fair 
18,0,It is fair that the best professionals earn a lot of money. 
18,0,Sport is a multi-million-pound industry. 
18,0,There is a large audience of sports fans. 
18,0,Sports on television attract many viewers. 
18,0,Sports stars have dedicated hours of practice to developing their fitness and skills. 
18,0,Only the most talented among them will reach the top. 
18,0,A sports career may only last 10 years. 
18,0,Sports fans are willing to pay to support their teams.
18,1,Sport and Politics
18,0,Some people think that sport and politics should remain separate. 
18,0,Governments are involved in the hosting of sporting events such as the Olympics. 
18,0,These events attract investment and create jobs.
18,0,The Olympic Games are an advertisement for the host nation. 
18,0,They attract huge numbers of visitors and sports fans. 
18,0,Wealthy countries tend to hold these events. 
18,0,Developing countries should be given the chance to become hosts.
19,1,Positives of Television
19,0,Watching television is a good way to relax. 
19,0,It is many people’s favourite way to wind down after a hard day at work. 
19,0,Television programmes can be entertaining and enjoyable. 
19,0,Viewers have access to a huge variety of entertainment channels. 
19,0,"Television brings the best comedians, musicians and actors into our homes. "
19,0,Programmes can also be informative and educational. 
19,0,News coverage makes the public aware of events around the world. 
19,0,Documentaries can make learning more interesting.
19,1,Negatives of Television
19,0,Some people link violence on television with crime rates in the real world.
19,0,Children copy the behaviour they see on the screen.
19,0,Children are less healthy because they spend less time playing.
19,0,Advertisers direct their marketing at children. 
19,0,Most programmes do not require much thought.
19,0,Watching TV is a waste of time that can be used on more meaningful tasks.
19,1,Opinions about Television
19,0,"Television has many benefits. However, it can be addictive."
19,0,Children should play outside rather than sit in front of a screen all day. 
19,0,Behaviour shown on TV can influence people. 
19,0,Parents should choose carefully what their children watch. 
19,0,"Children should not be exposed to violence, swearing or sexual images. "
19,0,Advertising during children’s programmes should be strictly controlled.
19,0,"TV companies should make more positive, educational programmes."
19,1,Positives of the Internet
19,0,There are many advantages to using the Internet. 
19,0,It gives us instant access to information on almost any subject. 
19,0,Shops and other services are now available online. 
19,0,People can buy goods and services from the comfort of their homes. 
19,0,The Internet is starting to replace other forms of entertainment. 
19,0,It has revolutionised communication. 
19,0,We can keep in touch by e-mail or instant messenger services. 
19,0,Video messaging is becoming common for business meetings.
19,1,Negatives of the Internet
19,0,Many websites contain offensive content. 
19,0,Some sites show violent or sexual images. 
19,0,Parents find it difficult to control what their children see online. 
19,0,They do not always know who their children are chatting to. 
19,0,With so many websites it is difficult to search for good information. 
19,0,Criminals increasingly use the Internet to steal people’s money.
