TYPE,ISTITLE,TOPIC
1,1,Positives of Advertising
1,0,Advertising is a key part of modern business.
1,0,Companies need to tell customers about their products. 
1,0,Advertisements inform us about the choices we have. 
1,0,Advertising is a creative industry that employs many people.
1,0,Advertising is a form of modern art.
1,1,Negatives of Advertising
1,0,Advertising manipulates people. 
1,0,It aims to persuade people that buying a product will make them happier. 
1,0,Advertisers focus on selling a brand image. 
1,0,"They use glamorous, successful people. We now live in a consumer culture. "
1,0,We are persuaded to follow the latest trends. 
1,0,We are encouraged to associate certain brands with a higher status. 
1,0,Advertisers often aim their marketing at children. 
1,0,Children can easily be influenced by advertisements. 
1,0,Children put pressure on parents to buy them things.
1,1,Opinions about Advertising
1,0,Advertising should be regulated. 
1,0,Advertising aimed at children should be controlled or even banned. 
1,0,Unhealthy foods should not be marketed in a way that attracts children. 
1,0,Products that can be a risk to health should display warnings. 
1,0,In some countries it is illegal to advertise cigarettes on television
1,0,Warnings must be displayed on cigarette packets. 
1,0,"However, advertising is necessary in free market economies. "
1,0,It creates demand for products. 
1,0,Governments should only censor false information or products that are harmful.
2,1,Arguments for Animal Testing
2,0,Animals are used in important scientific research. 
2,0,It is necessary to do medical tests on new drugs. 
2,0,Animal testing helps to advance medical and scientific knowledge. 
2,0,Many important medical discoveries involved experimentation on animals. 
2,0,Researchers aim to minimise the suffering that animals experience. 
2,0,Testing for the cosmetics industry is now banned in many countries.
2,1,Arguments against Animal Testing
2,0,The benefits of research using animals do not justify the suffering caused. 
2,0,There are alternative methods of research. 
2,0,The lives of animals should be respected. 
2,0,Humans have no moral right to do experiments on animals.
2,1,Arguments for Vegetarianism
2,0,Vegetarians do not eat foods that are produced by killing animals. 
2,0,Many people choose a vegetarian diet for moral or health reasons. 
2,0,A healthy diet is possible without eating meat. It is unnecessary to kill animals for food. 
2,0,A vegetarian diet may reduce the risk of diseases like cancer. 
2,0,Many people question the treatment of animals in factory farms.
2,1,Arguments against Vegetarianism
2,0,Vegetarians do not eat a balanced diet. 
2,0,"In many cultures, meat is the main ingredient in traditional meals. "
2,0,Meat-eaters argue that animals are below humans in the food chain. 
2,0,It is completely natural for us to kill them for food. 
2,0,Our aim should be to improve farming methods. 
2,0,Farms should produce organic food.
2,1,Positives of Zoos
2,0,Zoos play an important role in wildlife conservation. 
2,0,They can help to protect endangered species. 
2,0,Zoos allow scientists to study animals and their behaviour. 
2,0,"Zoos are educational, interesting and fun. Children, in particular, enjoy learning about animals. "
2,0,Zoos provide job opportunities.
2,1,Negatives of Zoos
2,0,Zoo animals are kept in artificial environments. 
2,0,They are kept in cages or have limited space. Zoo animals rely on humans. 
2,0,They lose the freedom to hunt for food. 
2,0,The best way to save endangered species is by protecting natural habitats. 
2,0,Some people believe that zoos are unethical. 
2,0,Zoos exhibit animals with the aim of making money. 
2,0,We have no right to use animals for entertainment and profit.
3,1,Reasons for Urbanisation
3,0,People move to cities in search of job opportunities. 
3,0,Cities offer greater employment possibilities and a higher standard of living. 
3,0,People migrate to cities from the countryside. 
3,0,Traditional activities like farming need fewer workers nowadays.
3,1,Negatives of City Life
3,0,Life in cities has its drawbacks. 
3,0,The cost of living is higher than in rural areas. 
3,0,Some people do not manage to find work. Housing is usually much more expensive. 
3,0,Homelessness and poverty are common in cities. 
3,0,There is a gap between the rich and poor. 
3,0,Life in cities can be extremely stressful. 
3,0,There are problems like traffic congestion and crime. 
3,0,Cities lack a sense of community. People do not even know their neighbours. 
3,0,Cities are sometimes described as “concrete jungles”.
3,1,Pedestrian Areas
3,0,Pedestrian zones in city centres can improve the local environment. 
3,0,Banning cars encourages people to walk or cycle. 
3,0,Many European cities have built bicycle lanes. 
3,0,Dependence on cars is linked to health problems like obesity. 
3,0,People who walk or cycle regularly are generally healthier. 
3,0,Pedestrian areas are safer and more attractive for both residents and tourists
4,1,Police and Crime Prevention
4,0,The job of the police is to catch criminals. 
4,0,They must also prevent crime and make communities safer. 
4,0,There should be an increase in the number of police officers on the streets. 
4,0,Police officers should be seen as part of the community. 
4,0,They should be involved with education and prevention. 
4,0,The police should be in close contact with schools. 
4,0,They should focus on young people who have dropped out of school. 
4,0,These teenagers may become involved with gangs.
4,1,Punishments / Prisons
4,0,Fines are used as punishment for minor crimes. 
4,0,"If the crime is more serious, prison is the most common punishment. "
4,0,Some criminals pose a threat to society. 
4,0,They are put in prison to ensure the safety of other citizens.
4,1,Negatives of Prisons
4,0,Criminals are put together. 
4,0,They make friends with other offenders. 
4,0,Many prisoners re-offend when they are released.
4,0,A criminal record makes finding a job more difficult.
4,1,Rehabilitation
4,0,Another aim of prisons is rehabilitation.
4,0,Prisoners receive education or vocational training. 
4,0,Prisoners should learn personal skills and specific job skills. 
4,0,Punishment could make prisoners’ behaviour worse. 
4,0,Rehabilitation aims to make them better citizens. 
4,0,Rehabilitated prisoners are less likely to re-offend.
4,1,Capital Punishment
4,0,Supporters say that capital punishment deters crime. 
4,0,Fear of the death penalty stops people from committing offences. 
4,0,The death penalty shows that crime is not tolerated. 
4,0,It is a form of revenge. 
4,0,The cost of imprisonment is avoided. 
4,0,The offender cannot pose a threat to others.
4,1,Against Capital Punishment
4,0,Innocent people could be wrongly convicted and executed. 
4,0,Crime rates are not necessarily reduced. 
4,0,Many criminals do not think they will be caught. 
4,0,Capital punishment is not a good deterrent.
4,0, Executing prisoners creates a violent culture and encourages revenge. 
4,0,We have no right to take another human life.
4,1,Community Service
4,0,Community service is a way to reform offenders. 
4,0,It could be a solution to prison overcrowding. 
4,0,It avoids the cost of imprisonment. 
4,0,It makes offenders useful in their local communities. 
4,0,They are required to clean streets or talk to school groups. 
4,0,Offenders repay their community. 
4,0,They avoid the negative influence that prison can have.
4,1,Against Community Service
4,0,Community service is not a sufficient punishment. 
4,0,"Criminals should be locked up, away from their victims."
4,1,Crime in the Media
4,0,Crime is one of the main subjects of most news programmes. 
4,0,The mass media focus on violent and sensational crimes. 
4,0,This leads to fear of crime among the public. 
4,0,Sensational stories attract more viewers or readers. 
4,0,The media report crime stories in order to increase their audience.
5,1,Benefits of Education
5,0,Education gives people knowledge and skills. 
5,0,People with qualifications are more likely to find work. 
5,0,They can earn a higher salary. 
5,0,They can contribute positively to society. 
5,0,Schools aim to teach young people moral values such as tolerance and sharing. 
5,0,Schools prepare children to be members of a society.
5,1,Benefits of Studying Abroad
5,0,Foreign institutions may offer better courses. 
5,0,Many students want to attend a prestigious university. 
5,0,The best universities employ teachers who are experts in their fields. 
5,0,Qualifications gained abroad can open the door to better job opportunities. 
5,0,Living abroad can broaden students’ horizons. 
5,0,Overseas students are exposed to different cultures and customs. 
5,0,They become more independent. 
5,0,"They are responsible for cooking, cleaning and paying bills. "
5,0,They will learn a foreign language.
5,1,Drawbacks of Studying Abroad
5,0,Living and studying abroad can be difficult. 
5,0,Students have problems with paperwork such as visa applications 
5,1,Education in Developing Countries: Problems
5,0,Children often have to work from an early age. 
5,0,There are no schools in many areas. 
5,0,Families do not have access to books or computers. 
5,0,Literacy rates are often low. 
5,0,People in developing countries need knowledge and skills. 
5,0,Education is the key to improving the economy of these countries.
5,1,Education in Developing Countries: Solutions
5,0,Developed countries could help developing nations by providing money.  
5,0,They could invest in schools and technology. 
5,0,They could supply the funds to build schools and pay for teachers. 
5,0,Children need to have access to free schooling. 
5,0,Computer equipment could be donated. 
5,0,The Internet can expose students to a world of knowledge and information. 
5,0,Governments should make education compulsory for all children. 
5,0,They should encourage parents to send their children to school. 
5,0,Governments of developed and developing countries must work together.
5,1,Higher Education: Advantages (also see “Benefits of Education”)
5,0,There are many benefits to going to university. 
5,0,A degree can open the door to better employment prospects. 
5,0,Economies are becoming increasingly knowledge-based. 
5,0,Most jobs require specific knowledge and skills. 
5,0,Skilled workers are needed for sectors such as information technology and engineering. 
5,0,Repetitive manual jobs are now done by machines. 
5,0,Many factories have moved to developing countries.
5,1,Higher Education: Disadvantages
5,0,A healthy economy needs a wide range of workers. 
5,0,Some manual workers will always be needed. 
5,0,A university degree is not necessary for many service professions. 
5,0,Practical training is more important in some industries.
5,1,Advantages of Home-Schooling
5,0,Some parents decide to educate their children at home. 
5,0,Some families live in isolated areas with poor transport. 
5,0,Other parents are not satisfied with local schools. 
5,0,Parents can respond to what their children need and how they learn best. 
5,0,One-to-one lessons allow much faster progress. 
5,0,The child can work at his or her own pace. 
5,0,Discipline problems are avoided by home-schooling.
5,1,Disadvantages of Home-Schooling
5,0,Most parents do not have the time to educate their children at home. 
5,0,One parent would need to give up work. 
5,0,School subjects are normally taught by up to ten different teachers. 
5,0,Most parents do not have the necessary knowledge or resources. 
5,0,Private tutors are expensive. 
5,0,Children will miss out on the social experience that school offers. 
5,0,"At school, children learn how to get on with each other. "
5,0,Home-schooled children may lack social skills. 
5,0,Schools offer a better overall educational experience.
5,1,Bad Behaviour in Schools: Causes
5,0,Bad behaviour is due to a lack of structure and discipline. 
5,0,There are too many children in some classes. Large classes are difficult to manage. 
5,0,Many disruptive students come from an unstable family background. 
5,0,Other parents are too lenient and spoil their children. 
5,0,Some children are used to getting whatever they want. 
5,0,Schools can do very little if they are not supported by parents.
5,1,Bad Behaviour in Schools: Solutions
5,0,Schools need a clear code of conduct. 
5,0,Schools need a clear set of rules about behaviour. 
5,0,They need to create a positive working atmosphere. 
5,0,Teachers must have the power to punish disruptive students. 
5,0,Schools should remove difficult children from lessons. 
5,0,Schools need to work closely with parents. 
5,0,Discipline could be lacking at home. 
5,0,Parents must support the school rules. 
5,0,They should take responsibility for their children’s behaviour.
5,1,Corporal Punishment: Opinion
5,0,Corporal Punishment is not a good idea. 
5,0,Physical punishment is a way of controlling children using fear. 
5,0,This does not promote trust between adults and children. 
5,0,Children who are punished physically may become shy or resentful. 
5,0,Corporal punishment creates an atmosphere of fear and anger.
5,1,Single Sex Education: Advantages
5,0,Some people believe that male and female students should go to separate schools. 
5,0,This is often for religious or cultural reasons. 
5,0,Discipline problems might be avoided by separating boys and girls. 
5,0,Boys and girls may learn in different ways and have different needs. 
5,0,Students at single-sex schools often get better exam grades.
5,1,Single-Sex Education: Disadvantages
5,0,Separating boys and girls is unnecessary. 
5,0,It is unhealthy in terms of children’s social development. 
5,0,Many coeducational schools are extremely successful. 
5,0,A mixed-sex environment is more representative of real life. 
5,0,Coeducational schools provide children with better social skills for adult life.
5,1,Advantages of Streaming (grouping children according to ability)
5,0,Some schools separate students according to their academic ability. 
5,0,Teachers can work at the right speed for their students. 
5,0,Teachers can plan more suitable lessons. High-level groups may progress faster. 
5,0,Lower level groups can benefit from a slower pace. 
5,0,Some teachers and parents support streaming for these reasons.
5,1,Disadvantages of Streaming
5,0,Grouping by ability may have a negative impact on students. 
5,0,Children do not want to be seen as less intelligent than others. 
5,0,Streaming could damage students’ self-esteem. 
5,0,They may lose motivation. 
5,0,Students from wealthier families tend to be better prepared. 
5,0,Children from poorer families may receive less support from parents. 
5,0,Mixed ability classes encourage everyone to achieve their potential.
6,1,Global Warming
6,0,Gases such as carbon dioxide trap heat from the sun. 
6,0,This causes global temperatures to rise. 
6,0,This process is known as the greenhouse effect. 
6,0,Human activity is a major factor in the rise of the greenhouse gases. 
6,0,Factories and vehicles produce emissions and exhaust fumes. 
6,0,Many developing countries are becoming industrialised. 
6,0,The number of cars on our streets is growing. 
6,0,Cheap air travel is allowing more people to fly.
6,1,Effects of Global Warming
6,0,Global warming will have a significant impact on our planet. 
6,0,Rising temperatures will cause melting of the polar ice caps. 
6,0,Sea levels will rise. 
6,0,We can expect more extreme weather conditions. 
6,0,Flooding and droughts may become more common.
6,1,Impact of Humans on the Environment
6,0,The increasing world population is putting pressure on natural resources. 
6,0,Fossil fuels like oil and gas are running out. 
6,0,We are destroying wildlife habitats. 
6,0,We have cut down enormous areas of rainforest. 
6,0,This has led to the extinction of many species of animals and plants.
6,1,Solutions to Environment Problems
6,0,Governments could introduce laws to limit emissions from factories. 
6,0,"They should invest in renewable energy from solar, wind or water power. "
6,0,They could impose “green taxes” on drivers and airline companies. 
6,0,Government campaigns should promote recycling. 
6,0,Natural areas and wild animals should be protected. 
6,0,Individuals should also try to be greener. 
6,0,We should take fewer flights abroad for holidays. 
6,0,We should take public transport rather than driving. 
6,0,We should choose products with less packaging. 
6,0,We should recycle as much as possible.
6,1,Waste / Rubbish
6,0,The amount of waste we produce has increased. 
6,0,This problem is a result of our consumer culture. 
6,0,Products are not made to last. 
6,0,"If something breaks, we throw it away and buy a new one. "
6,0,Advertisers encourage us to buy the newest fashions. 
6,0,Packaging is an important part of selling. 
6,0,Most foods are sold in non-biodegradable plastic packaging. 
6,0,The amount of household waste is growing. 
6,0,This waste ends up in landfill sites.
6,1,Litter 
6,0,People do not think about the consequences of dropping rubbish. 
6,0,They assume that somebody is paid to clean the streets. 
6,0,Plastic packaging does not break down easily. 
6,0,Most of the litter seen on streets is fast food packaging.
6,1,Recycling and Other Solutions
6,0,Companies should make goods that last longer. 
6,0,They should not use so much packaging. 
6,0,Governments should be stricter about waste produced by companies. 
6,0,They should put legal limits on packaging. 
6,0,Consumers should avoid buying over-packaged products. 
6,0,We should recycle and reuse useful materials. 
6,0,"There are collection banks for glass, paper and plastic bottles. "
6,0,Households can use several rubbish bins to separate waste. Recycling saves energy and raw materials.
6,1,Nuclear Power: Positives
6,0,There are several benefits to building more nuclear power stations. 
6,0,Fossil fuels like oil and gas are running out. 
6,0,Nuclear power is a relatively sustainable energy source. 
6,0,It can be used to produce electricity without wasting natural resources. 
6,0,"It could replace the use of natural resources like coal, oil or gas. "
6,0,Nuclear power stations are cleaner than fossil fuel power stations. 
6,0,They could help to reduce carbon emissions that cause global warming. 
6,0,The risks of accidents are being reduced.
6,1,Nuclear Power: Negatives
6,0,Opponents of nuclear power worry about the safety of power stations. 
6,0,The building of new nuclear power stations is unpopular. 
6,0,Nobody wants to live near one. 
6,0,Nuclear waste disposal is a significant problem. 
6,0,There is currently no way to decontaminate radioactive material. 
6,0,People worry that terrorists could steal radioactive materials. 
6,0,"It is safer to produce energy from solar, wind or water power."
7,1,Family Size
7,0,Families in many countries are not as large as they used to be. 
7,0,We tend to live in small nuclear families rather than large extended families. 
7,0,Parents tend to have fewer children. 
7,0,Young children are no longer expected to work. 
7,0,Nowadays both parents often work. 
7,0,It costs so much to bring children up. 
7,0,It is more difficult to raise a large family.
7,1,Working Parents (also see “Gender” topic)
7,0,Children and their parents seem to be less close nowadays. 
7,0,Parents spend less time with their children. 
7,0,"Women traditionally stayed at home to cook, clean and look after children. "
7,0,Nowadays both parents often work full time. 
7,0,"Children may be left alone, or with nannies or babysitters. "
7,0,Busy parents have less contact with their children. 
7,0,Many families no longer eat meals together. 
7,0,Children spend more time with friends or surfing the Internet.
7,1,Negative Effects on Children
7,0,The lack of closeness in families can have a negative effect on children. 
7,0,Many parents have no idea how their children spend their time. 
7,0,"Friends, television and the Internet become the main influences on children’s behaviour. "
7,0,Teenagers are influenced by peer pressure. 
7,0,Some of them join gangs. 
7,0,Juvenile delinquency is on the increase. 
7,0,Parents should be more involved with their children’s upbringing. 
7,0,Young people need positive role models.
7,1,Divorce
7,0,"In the past, divorce was unacceptable. "
7,0,It was considered to be embarrassing for a family. 
7,0,People stayed together for religious or family reasons. 
7,0,Divorce is more socially acceptable nowadays.
7,0,It has become much more common. 
7,0,Divorce can be extremely stressful. 
7,0,Lone parents may face financial difficulties. 
7,0,Many single parents have to rely on benefits paid by the state. 
7,0,Divorce can have a negative effect on children. 
7,0,Children from single-parent families are more likely to get lower grades or drop out of school. 
7,0,The rise in divorce rates may be connected to some social problems.
7,1,Care for Old People
7,0,Caring for elderly people was traditionally the responsibility of families. 
7,0,Adults had to look after their elderly parents. 
7,0,A woman’s job was to stay at home taking care of her family. 
7,0,"Nowadays, fewer elderly people are looked after by their relatives. "
7,0,Residential homes provide care for large numbers of elderly people. 
7,0,Some families are unable to look after elderly relatives. 
7,0,"Families tend to be smaller these days, and women often have full-time jobs. "
7,0,Care homes provide a professional service for senior citizens. 
7,0,Nurses are better trained than family members.
7,1,Care for Old People: Opinion
7,0,The best form of care for the elderly depends on the family situation. 
7,0,It depends on whether family members have the time and resources. 
7,0,We all have a responsibility towards the older people in our society. 
7,0,Governments should invest money in facilities and training for care workers.
8,1,Gender and Education
8,0,Men and women should have access to the same educational opportunities. 
8,0,Males and females should be accepted onto courses according to their abilities. 
8,0,It is wrong to discriminate against students because of their gender. 
8,0,Gender should be irrelevant in education. 
8,0,Students’ achievements should depend on hard work and individual merit. 
8,0,"In the UK, there are similar numbers of male and female students in higher education."
8,1,Gender and Work
8,0,Men and women should have access to the same professional opportunities. 
8,0,Both men and women should be able to pursue a career. 
8,0,They should earn equal salaries. 
8,0,"They should be employed according to their abilities, qualifications and experience. "
8,0,"Traditionally, women have been restricted to certain roles. "
8,0,They were often employed as secretaries or receptionists. 
8,0,"Nowadays, a range of occupations is available to both sexes. "
8,0,Career success depends on individual merit.
8,1,Women’s and Men’s Role in the Family
8,0,"Some people argue that a mother should not work, she should stay at home and bring up her children. "
8,0,The father should be the breadwinner of the family. 
8,0,Others believe that both parents should share these responsibilities. 
8,0,Working women can take maternity leave during and after pregnancy. 
8,0,Many mothers continue to work after this period. 
8,0,Many fathers and mothers share their parenting and domestic responsibilities. 
8,0,"They contribute equally to childcare, cooking and cleaning. "
8,0,Some women may have better career prospects than their husbands. 
8,0,Paternity leave and “househusbands” are becoming more common. 
8,0,Traditional gender roles are gradually changing. 
8,0,Families can divide roles and responsibilities in the most convenient way.
9,1,Positives of Genetic Engineering
9,0,Genetic engineering is the practice of manipulating the genes of an organism. 
9,0,It is used to produce crops that are more resistant to insects and diseases. 
9,0,Some genetically modified crops grow more quickly. 
9,0,Some drugs and vaccines are produced by genetic engineering. 
9,0,It may become possible to change humans’ genetic characteristics. 
9,0,Scientists may use genetic engineering to cure diseases. Inherited illnesses would no longer exist. 
9,0,Genes could be changed before a baby is born. 
9,0,It could also be possible to clone human organs. 
9,0,We could all have replacement body parts. 
9,0,"Humans could live longer, healthier lives."
9,1,Negatives of Genetic Engineering
9,0,There are ethical concerns about human genetic engineering. 
9,0,Parents might want to choose their children’s characteristics. This would be unnatural. 
9,0,It would be unacceptable in most religions. 
9,0,Soldiers could be cloned from the genes of the strongest people. 
9,0,Clones might be used like robots to do certain jobs.
9,0,Clones might even be developed just for organ replacements. 
9,0,Society and human evolution would change completely. 
9,0,"Currently, human genetic engineering is prohibited."
9,1,Genetically-Modified (GM) Foods: Advantages
9,0,Farmers can produce crops that grow bigger and faster. 
9,0,Some GM crops are more resistant to disease or insects. 
9,0,This could be important for food production in developing countries. 
9,0,"Faster growing cereals, fruit and vegetables will mean more profit."
9,0,GM foods can be modified to look perfect. They may be more attractive to customers.
9,1,Genetically-Modified (GM) Foods: Disadvantages
9,0,There may be risks involved in the genetic engineering of foods.
